var_name,Value,Unit,Comment
root_frac,0.71,[],Root chord / span of the vertical tail
sweep_angle_user,NaN,[degrees],Sweep angle of the vertical wing (NaN for auto)
taper_ratio_user,0.33333,[ratio],Taper ratio of the vertical wing (NaN for auto)
dihedral_angle_user,0,[degrees],Dihedral angle of the main wing (NaN for auto)
TechFactor,0.86,[],TechFactor of the vertical  wing
airfoil_root,airfoil.dat,[],root airfoil file name
airfoil_tip,airfoil.dat,[],tip airfoil file name
rud_angle,32,[degrees],The rotation angle of the rudder
